{
  "id": "new-outcome-id",
  "team": "team-id",
  "title": "Short outcome title",
  "summary": "One honest note on what changed or what did not.",
  "status": "kept",
  "risks": ["feasibility"],
  "dimensions": ["impact-learning"],
  "linkedTools": [],
  "linkedPlays": [],
  "linkedExperiments": []
}
